{
  "format": "ultimate-calendar-busy",
  "version": 1,
  "timezone": "Asia/Shanghai",
  "source": {
    "kind": "cloud",
    "dataInstanceId": "11111111-1111-4111-8111-111111111111",
    "generation": 1
  },
  "fromDate": "2030-04-15",
  "toDate": "2030-04-21",
  "exportedAt": "2030-04-15T08:00:00+08:00",
  "request": "请避开这些忙碌时间，为一个新目标制定完整的一周计划。",
  "instructions": [
    "这是日历忙碌时间参考文件，不能直接导入日历；它不包含已有目标、任务正文、资源或来源原文。",
    "如需创建完整的新目标计划，请返回 format 为 ultimate-calendar-plan、version 为 1、timezone 为 Asia/Shanghai 的 JSON 文件。",
    "在 goals、tasks、blocks 中分别列出新目标、新任务和学习时段，并为每条记录分配文件内唯一 id；任务通过 goalRef 引用本文件目标，时段通过 taskRef 引用本文件任务。",
    "给这份新计划分配独立稳定的 planId。相同文件重试应保持内容及编号不变，不要复制已有事项来覆盖它们；不输出更新或删除操作。",
    "安排学习时段时避开 busyIntervals，并尊重用户给出的时长、日期和休息要求；课程、活动和执行时段都已计入，截止日期和待判断事项不是忙碌占用。",
    "本文件只是导出当时的占用参考，不提供目标上下文的自动基线保护。生成的计划导入时仍须预览并核对当时最新的时间冲突。",
    "需要资料时可在新计划 resources 中给出网页资料并用 resourceRefs 关联；不要制造本机文件路径或凭据。"
  ],
  "busyIntervals": [
    {
      "start": "2030-04-15T19:00:00+08:00",
      "end": "2030-04-15T19:45:00+08:00",
      "category": "work"
    },
    {
      "start": "2030-04-16T19:00:00+08:00",
      "end": "2030-04-16T19:45:00+08:00",
      "category": "work"
    }
  ],
  "coverage": "仅覆盖 2030-04-15 至 2030-04-21 的上海时间日期范围（含首尾日期），共 2 个已确认忙碌区间。跨界时段已裁剪；未填结束时间的事件按应用默认时长计算。取消事项、截止时间和待判断事项不计入，范围外的安排未导出。"
}
